{
  "$defs": {
    "Target": {
      "additionalProperties": false,
      "properties": {
        "asset_id": {
          "anyOf": [
            {
              "pattern": "^[a-z0-9][a-z0-9._-]{0,63}$",
              "type": "string"
            },
            {
              "type": "null"
            }
          ],
          "default": null,
          "title": "Asset Id"
        },
        "clip_id": {
          "anyOf": [
            {
              "pattern": "^[a-z0-9][a-z0-9._-]{0,63}$",
              "type": "string"
            },
            {
              "type": "null"
            }
          ],
          "default": null,
          "title": "Clip Id"
        },
        "expected_revision": {
          "anyOf": [
            {
              "minimum": 0,
              "type": "integer"
            },
            {
              "type": "null"
            }
          ],
          "default": null,
          "title": "Expected Revision"
        },
        "instance_id": {
          "anyOf": [
            {
              "pattern": "^[a-z0-9][a-z0-9._-]{0,63}$",
              "type": "string"
            },
            {
              "type": "null"
            }
          ],
          "default": null,
          "title": "Instance Id"
        },
        "shot_id": {
          "anyOf": [
            {
              "pattern": "^[a-z0-9][a-z0-9._-]{0,63}$",
              "type": "string"
            },
            {
              "type": "null"
            }
          ],
          "default": null,
          "title": "Shot Id"
        }
      },
      "title": "Target",
      "type": "object"
    }
  },
  "$id": "https://fluidblend.local/schemas/operation-request.json",
  "$schema": "https://json-schema.org/draft/2020-12/schema",
  "additionalProperties": false,
  "description": "Common envelope (§6.4). `parameters` is validated by the operation's own model.",
  "properties": {
    "dry_run": {
      "default": false,
      "title": "Dry Run",
      "type": "boolean"
    },
    "operation": {
      "pattern": "^[a-z_]+\\.[a-z_]+$",
      "title": "Operation",
      "type": "string"
    },
    "operation_id": {
      "pattern": "^[A-Za-z0-9][A-Za-z0-9._-]{2,99}$",
      "title": "Operation Id",
      "type": "string"
    },
    "parameters": {
      "additionalProperties": true,
      "title": "Parameters",
      "type": "object"
    },
    "project_id": {
      "pattern": "^[a-z0-9][a-z0-9._-]{0,63}$",
      "title": "Project Id",
      "type": "string"
    },
    "schema_version": {
      "default": "1.0",
      "title": "Schema Version",
      "type": "string"
    },
    "target": {
      "$ref": "#/$defs/Target"
    }
  },
  "required": [
    "operation",
    "operation_id",
    "project_id"
  ],
  "title": "OperationRequest",
  "type": "object"
}
