{
  "schema_version": "1.0",
  "operation": "animation.create",
  "operation_id": "animation-create-001",
  "project_id": "demo-studio",
  "target": {
    "shot_id": "shot010",
    "instance_id": "hero-01"
  },
  "parameters": {
    "preset": "idle_neutral",
    "output_clip": "idle-neutral",
    "seed": 7,
    "amplitude": 0.3,
    "frame_range": {
      "start": 1,
      "end_exclusive": 49
    }
  },
  "dry_run": false
}
