{
  "schema_version": "1.0",
  "operation": "animation.apply",
  "operation_id": "animation-apply-001",
  "project_id": "demo-studio",
  "target": {
    "shot_id": "shot010",
    "instance_id": "hero-01"
  },
  "parameters": {
    "clip_id": "idle-loop",
    "start_frame": 1
  },
  "dry_run": false
}
