{
  "schema_version": "1.0",
  "operation": "animation.retime",
  "operation_id": "retime-shot010-hero-001",
  "project_id": "demo-studio",
  "target": {"shot_id": "shot010", "instance_id": "hero-01", "clip_id": "walk", "expected_revision": 1},
  "parameters": {
    "duration_scale": 1.2,
    "preserve_contact_markers": true,
    "output_variant": "walk-slower-v001",
    "preview_samples": 8
  },
  "dry_run": false
}
