{
  "schema_version": "1.0",
  "operation": "animation.create",
  "operation_id": "animation-create-take-001",
  "project_id": "demo-studio",
  "target": {
    "shot_id": "shot010",
    "instance_id": "hero-01"
  },
  "parameters": {
    "preset": "take_prop",
    "output_clip": "take-baton",
    "hand": "right",
    "prop_instance_id": "baton-01"
  },
  "dry_run": false
}
