{
  "schema_version": "1.0",
  "operation": "shot.preview",
  "operation_id": "preview-shot010-blocking-001",
  "project_id": "demo-studio",
  "target": {"shot_id": "shot010"},
  "parameters": {
    "frame_start": 1,
    "frame_end_exclusive": 241,
    "step": 1,
    "engine": "WORKBENCH",
    "width": 640,
    "height": 360,
    "label": "blocking"
  },
  "dry_run": false
}
