{
  "schema_version": "1.0",
  "operation": "rig.validate",
  "operation_id": "rig-validate-001",
  "project_id": "demo-studio",
  "target": {
    "shot_id": "shot010",
    "instance_id": "hero-01"
  },
  "parameters": {
    "profile_path": "reviews/shot010/rig-map-001/rig-profile.json"
  },
  "dry_run": false
}
