{
  "schema_version": "1.0",
  "operation": "animation.loop",
  "operation_id": "animation-loop-001",
  "project_id": "demo-studio",
  "target": {
    "shot_id": "shot010",
    "instance_id": "hero-01",
    "clip_id": "idle-neutral"
  },
  "parameters": {
    "output_clip": "idle-loop",
    "repetitions": 3
  },
  "dry_run": false
}
